{
  "corpus_id": "he_02_noise_and_borderline",
  "version": "2.0.0",
  "title": "Noise and borderline cases",
  "purpose": "Проверяет поведение pipeline на шумовых данных: числа, латиница, пунктуация, смешанные строки.",
  "language": "he",
  "domain": "noise filtering",
  "recommended_profile": "any",
  "text_count": 8,
  "files": [
    {
      "filename": "noise_empty_like.txt",
      "sentence_count": 1,
      "token_count": 4
    },
    {
      "filename": "noise_hebrew_with_punct.txt",
      "sentence_count": 5,
      "token_count": 11
    },
    {
      "filename": "noise_latin.txt",
      "sentence_count": 5,
      "token_count": 5
    },
    {
      "filename": "noise_math.txt",
      "sentence_count": 5,
      "token_count": 5
    },
    {
      "filename": "noise_mixed.txt",
      "sentence_count": 5,
      "token_count": 5
    },
    {
      "filename": "noise_numbers.txt",
      "sentence_count": 7,
      "token_count": 5
    },
    {
      "filename": "noise_punct_only.txt",
      "sentence_count": 1,
      "token_count": 5
    },
    {
      "filename": "noise_quantity.txt",
      "sentence_count": 6,
      "token_count": 5
    }
  ],
  "expected_primary_checks": [
    "sentence_count",
    "token_count"
  ],
  "assertion_policy": {
    "sentence_count": "exact",
    "token_count": "exact"
  },
  "manual_review_focus": [],
  "known_limitations": [],
  "notes": "v2 — Проверяет поведение pipeline на шумовых данных: числа, латиница, пунктуация, смешанные строки."
}