{
  "corpus_id": "he_19_prefix_handling",
  "version": "2.0.0",
  "title": "Hebrew prefix handling",
  "purpose": "Проверяет обработку еврейских префиксов ב/ל/כ/מ/וש.",
  "language": "he",
  "domain": "metallurgy",
  "recommended_profile": "any",
  "text_count": 2,
  "files": [
    {
      "filename": "prefix_basic.txt",
      "sentence_count": 5,
      "token_count": 17
    },
    {
      "filename": "prefix_combined.txt",
      "sentence_count": 5,
      "token_count": 17
    }
  ],
  "expected_primary_checks": [
    "sentence_count",
    "token_count"
  ],
  "assertion_policy": {
    "sentence_count": "exact",
    "token_count": "exact"
  },
  "manual_review_focus": [],
  "known_limitations": [],
  "notes": "v2 — white spot #: Проверяет обработку еврейских префиксов ב/ל/כ/מ/וש."
}