{
  "corpus_id": "he_10_stress_small_corpus",
  "version": "2.0.0",
  "title": "Stress test: tiny corpus",
  "purpose": "Проверяет поведение на маленьком насыщенном корпусе.",
  "language": "he",
  "domain": "metallurgy",
  "recommended_profile": "any",
  "text_count": 4,
  "files": [
    {
      "filename": "mini_dense.txt",
      "sentence_count": 6,
      "token_count": 42
    },
    {
      "filename": "mini_sparse.txt",
      "sentence_count": 3,
      "token_count": 20
    },
    {
      "filename": "tiny_01.txt",
      "sentence_count": 4,
      "token_count": 4
    },
    {
      "filename": "tiny_02.txt",
      "sentence_count": 5,
      "token_count": 8
    }
  ],
  "expected_primary_checks": [
    "sentence_count",
    "token_count"
  ],
  "assertion_policy": {
    "sentence_count": "exact",
    "token_count": "exact"
  },
  "manual_review_focus": [],
  "known_limitations": [],
  "notes": "v2 — Проверяет поведение на маленьком насыщенном корпусе."
}