{
  "corpus_id": "he_14_association_measures",
  "version": "2.0.0",
  "title": "Association measures: PMI/LLR/Dice",
  "purpose": "Проверяет абсолютные значения ассоциативных мер для терминов.",
  "language": "he",
  "domain": "metallurgy",
  "recommended_profile": "balanced",
  "text_count": 3,
  "files": [
    {
      "filename": "terms_contrast.txt",
      "sentence_count": 5,
      "token_count": 17
    },
    {
      "filename": "terms_high_pmi.txt",
      "sentence_count": 4,
      "token_count": 22
    },
    {
      "filename": "terms_low_pmi.txt",
      "sentence_count": 4,
      "token_count": 16
    }
  ],
  "expected_primary_checks": [
    "sentence_count",
    "token_count"
  ],
  "assertion_policy": {
    "sentence_count": "exact",
    "token_count": "exact"
  },
  "manual_review_focus": [],
  "known_limitations": [],
  "notes": "v2 — white spot #: Проверяет абсолютные значения ассоциативных мер для терминов."
}