{
  "corpus_id": "he_25_construct_chains",
  "version": "2.0.0",
  "title": "Hebrew construct chains",
  "purpose": "Проверяет обработку цепочек סмיכות (short, long, nested).",
  "language": "he",
  "domain": "metallurgy",
  "recommended_profile": "any",
  "text_count": 3,
  "files": [
    {
      "filename": "long_construct.txt",
      "sentence_count": 5,
      "token_count": 16
    },
    {
      "filename": "nested_construct.txt",
      "sentence_count": 3,
      "token_count": 13
    },
    {
      "filename": "short_construct.txt",
      "sentence_count": 5,
      "token_count": 10
    }
  ],
  "expected_primary_checks": [
    "sentence_count",
    "token_count"
  ],
  "assertion_policy": {
    "sentence_count": "exact",
    "token_count": "exact"
  },
  "manual_review_focus": [],
  "known_limitations": [],
  "notes": "v2 — white spot #: Проверяет обработку цепочек סмיכות (short, long, nested)."
}