{
  "corpus_id": "he_20_numbers_units",
  "version": "2.0.0",
  "title": "Numbers and units",
  "purpose": "Проверяет обработку еврейских числительных, процентов, единиц.",
  "language": "he",
  "domain": "metallurgy",
  "recommended_profile": "any",
  "text_count": 3,
  "files": [
    {
      "filename": "hebrew_numerals.txt",
      "sentence_count": 5,
      "token_count": 15
    },
    {
      "filename": "mixed_numbers.txt",
      "sentence_count": 6,
      "token_count": 10
    },
    {
      "filename": "percentages.txt",
      "sentence_count": 5,
      "token_count": 17
    }
  ],
  "expected_primary_checks": [
    "sentence_count",
    "token_count"
  ],
  "assertion_policy": {
    "sentence_count": "exact",
    "token_count": "exact"
  },
  "manual_review_focus": [],
  "known_limitations": [],
  "notes": "v2 — white spot #: Проверяет обработку еврейских числительных, процентов, единиц."
}