{
  "corpus_id": "he_12_reference_sensitive_terms",
  "version": "2.0.0",
  "title": "Reference-sensitive terms",
  "purpose": "Проверяет термы, зависящие от reference corpus.",
  "language": "he",
  "domain": "metallurgy",
  "recommended_profile": "balanced",
  "text_count": 4,
  "files": [
    {
      "filename": "borderline_terms.txt",
      "sentence_count": 6,
      "token_count": 19
    },
    {
      "filename": "domain_vs_general.txt",
      "sentence_count": 6,
      "token_count": 25
    },
    {
      "filename": "ref_sensitive_01.txt",
      "sentence_count": 12,
      "token_count": 93
    },
    {
      "filename": "ref_sensitive_02.txt",
      "sentence_count": 10,
      "token_count": 79
    }
  ],
  "expected_primary_checks": [
    "sentence_count",
    "token_count"
  ],
  "assertion_policy": {
    "sentence_count": "exact",
    "token_count": "exact"
  },
  "manual_review_focus": [],
  "known_limitations": [],
  "notes": "v2 — Проверяет термы, зависящие от reference corpus."
}