{
  "corpus_id": "he_08_tm_projection_candidates",
  "version": "2.0.0",
  "title": "TM projection candidates",
  "purpose": "Проверяет surfaces suitable for TM review, deduplication sensitivity.",
  "language": "he",
  "domain": "engineering",
  "recommended_profile": "balanced",
  "text_count": 2,
  "files": [
    {
      "filename": "tm_dedup_01.txt",
      "sentence_count": 5,
      "token_count": 27
    },
    {
      "filename": "tm_stable_01.txt",
      "sentence_count": 5,
      "token_count": 30
    }
  ],
  "expected_primary_checks": [
    "sentence_count",
    "token_count"
  ],
  "assertion_policy": {
    "sentence_count": "exact",
    "token_count": "exact"
  },
  "manual_review_focus": [],
  "known_limitations": [],
  "notes": "v2 — Проверяет surfaces suitable for TM review, deduplication sensitivity."
}