{
  "corpus_id": "he_09_mixed_domain_materials",
  "version": "2.0.0",
  "title": "Mixed domain with noise",
  "purpose": "Проверяет domain discrimination, generic words vs strong terms.",
  "language": "he",
  "domain": "mixed",
  "recommended_profile": "balanced",
  "text_count": 3,
  "files": [
    {
      "filename": "domain_general.txt",
      "sentence_count": 5,
      "token_count": 25
    },
    {
      "filename": "domain_noise.txt",
      "sentence_count": 5,
      "token_count": 18
    },
    {
      "filename": "domain_steel.txt",
      "sentence_count": 5,
      "token_count": 26
    }
  ],
  "expected_primary_checks": [
    "sentence_count",
    "token_count"
  ],
  "assertion_policy": {
    "sentence_count": "exact",
    "token_count": "exact"
  },
  "manual_review_focus": [],
  "known_limitations": [],
  "notes": "v2 — Проверяет domain discrimination, generic words vs strong terms."
}