{
  "corpus_id": "he_04_ngram_np_patterns",
  "version": "2.0.0",
  "title": "N-gram and NP patterns",
  "purpose": "Проверяет NOUN+NOUN, NOUN+ADJ, ADJ+NOUN паттерны, DET blocking.",
  "language": "he",
  "domain": "metallurgy",
  "recommended_profile": "any",
  "text_count": 4,
  "files": [
    {
      "filename": "np_adj_noun.txt",
      "sentence_count": 5,
      "token_count": 10
    },
    {
      "filename": "np_complex.txt",
      "sentence_count": 5,
      "token_count": 25
    },
    {
      "filename": "np_noun_adj_noun.txt",
      "sentence_count": 5,
      "token_count": 15
    },
    {
      "filename": "np_noun_noun.txt",
      "sentence_count": 5,
      "token_count": 10
    }
  ],
  "expected_primary_checks": [
    "sentence_count",
    "token_count"
  ],
  "assertion_policy": {
    "sentence_count": "exact",
    "token_count": "exact"
  },
  "manual_review_focus": [],
  "known_limitations": [],
  "notes": "v2 — Проверяет NOUN+NOUN, NOUN+ADJ, ADJ+NOUN паттерны, DET blocking."
}