{
  "corpus_id": "he_17_named_entities",
  "version": "2.0.0",
  "title": "Named entity recognition",
  "purpose": "Проверяет NER: организации, география, персонажи.",
  "language": "he",
  "domain": "mixed",
  "recommended_profile": "any",
  "text_count": 3,
  "files": [
    {
      "filename": "entities_geo.txt",
      "sentence_count": 4,
      "token_count": 17
    },
    {
      "filename": "entities_org.txt",
      "sentence_count": 4,
      "token_count": 19
    },
    {
      "filename": "entities_person.txt",
      "sentence_count": 4,
      "token_count": 20
    }
  ],
  "expected_primary_checks": [
    "sentence_count",
    "token_count"
  ],
  "assertion_policy": {
    "sentence_count": "exact",
    "token_count": "exact"
  },
  "manual_review_focus": [],
  "known_limitations": [],
  "notes": "v2 — white spot #: Проверяет NER: организации, география, персонажи."
}