{
  "corpus_id": "he_26_homographs",
  "version": "2.0.0",
  "title": "Homograph disambiguation",
  "purpose": "Проверяет омонимию: הרכב (состав/машина), בדיקה (noun/verb).",
  "language": "he",
  "domain": "general",
  "recommended_profile": "any",
  "text_count": 3,
  "files": [
    {
      "filename": "homograph_comp.txt",
      "sentence_count": 3,
      "token_count": 13
    },
    {
      "filename": "homograph_construct.txt",
      "sentence_count": 3,
      "token_count": 10
    },
    {
      "filename": "homograph_verb_noun.txt",
      "sentence_count": 3,
      "token_count": 12
    }
  ],
  "expected_primary_checks": [
    "sentence_count",
    "token_count"
  ],
  "assertion_policy": {
    "sentence_count": "exact",
    "token_count": "exact"
  },
  "manual_review_focus": [],
  "known_limitations": [],
  "notes": "v2 — white spot #: Проверяет омонимию: הרכב (состав/машина), בדיקה (noun/verb)."
}