{
  "corpus_id": "he_13_canonicalization",
  "version": "2.0.0",
  "title": "Canonicalization: surface-to-canonical mapping",
  "purpose": "Проверяет маппинг поверхностных форм к canonical form: construct, DET, число/род.",
  "language": "he",
  "domain": "metallurgy",
  "recommended_profile": "any",
  "text_count": 3,
  "files": [
    {
      "filename": "canon_construct.txt",
      "sentence_count": 5,
      "token_count": 29
    },
    {
      "filename": "canon_det_variants.txt",
      "sentence_count": 5,
      "token_count": 20
    },
    {
      "filename": "canon_variants.txt",
      "sentence_count": 6,
      "token_count": 27
    }
  ],
  "expected_primary_checks": [
    "sentence_count",
    "token_count"
  ],
  "assertion_policy": {
    "sentence_count": "exact",
    "token_count": "exact"
  },
  "manual_review_focus": [],
  "known_limitations": [],
  "notes": "v2 — white spot #: Проверяет маппинг поверхностных форм к canonical form: construct, DET, число/род."
}