{
  "corpus_id": "he_16_np_boundaries",
  "version": "2.0.0",
  "title": "NP chunk boundaries",
  "purpose": "Проверяет границы именных групп: nested, coordinated, PP-attached.",
  "language": "he",
  "domain": "metallurgy",
  "recommended_profile": "any",
  "text_count": 3,
  "files": [
    {
      "filename": "coordinated_np.txt",
      "sentence_count": 4,
      "token_count": 16
    },
    {
      "filename": "nested_np.txt",
      "sentence_count": 4,
      "token_count": 19
    },
    {
      "filename": "pp_attached.txt",
      "sentence_count": 4,
      "token_count": 20
    }
  ],
  "expected_primary_checks": [
    "sentence_count",
    "token_count"
  ],
  "assertion_policy": {
    "sentence_count": "exact",
    "token_count": "exact"
  },
  "manual_review_focus": [],
  "known_limitations": [],
  "notes": "v2 — white spot #: Проверяет границы именных групп: nested, coordinated, PP-attached."
}