{
  "corpus_id": "he_05_terms_balanced",
  "version": "2.0.0",
  "title": "Balanced term extraction",
  "purpose": "Проверяет balanced term extraction на инженерном материале.",
  "language": "he",
  "domain": "engineering",
  "recommended_profile": "balanced",
  "text_count": 3,
  "files": [
    {
      "filename": "engineering_01.txt",
      "sentence_count": 5,
      "token_count": 30
    },
    {
      "filename": "materials_01.txt",
      "sentence_count": 5,
      "token_count": 32
    },
    {
      "filename": "mechanics_01.txt",
      "sentence_count": 5,
      "token_count": 29
    }
  ],
  "expected_primary_checks": [
    "sentence_count",
    "token_count"
  ],
  "assertion_policy": {
    "sentence_count": "exact",
    "token_count": "exact"
  },
  "manual_review_focus": [],
  "known_limitations": [],
  "notes": "v2 — Проверяет balanced term extraction на инженерном материале."
}