{
  "corpus_id": "he_15_sentence_boundary_edge",
  "version": "2.0.0",
  "title": "Sentence boundary edge cases",
  "purpose": "Проверяет split на предложения: аббревиатуры, десятичные, обрывы, многоточие.",
  "language": "he",
  "domain": "general",
  "recommended_profile": "any",
  "text_count": 4,
  "files": [
    {
      "filename": "abbr_hebrew.txt",
      "sentence_count": 4,
      "token_count": 18
    },
    {
      "filename": "decimals.txt",
      "sentence_count": 8,
      "token_count": 16
    },
    {
      "filename": "multi_punct.txt",
      "sentence_count": 4,
      "token_count": 10
    },
    {
      "filename": "no_period.txt",
      "sentence_count": 3,
      "token_count": 14
    }
  ],
  "expected_primary_checks": [
    "sentence_count",
    "token_count"
  ],
  "assertion_policy": {
    "sentence_count": "exact",
    "token_count": "exact"
  },
  "manual_review_focus": [],
  "known_limitations": [],
  "notes": "v2 — white spot #: Проверяет split на предложения: аббревиатуры, десятичные, обрывы, многоточие."
}