{
  "corpus_id": "he_21_empty_degenerate",
  "version": "2.0.0",
  "title": "Empty and degenerate documents",
  "purpose": "Проверяет поведение на пустых, near-empty, single-word документах.",
  "language": "he",
  "domain": "general",
  "recommended_profile": "any",
  "text_count": 4,
  "files": [
    {
      "filename": "one_sentence_no_dot.txt",
      "sentence_count": 1,
      "token_count": 5
    },
    {
      "filename": "single_dot.txt",
      "sentence_count": 0,
      "token_count": 1
    },
    {
      "filename": "single_word.txt",
      "sentence_count": 1,
      "token_count": 1
    },
    {
      "filename": "whitespace_only.txt",
      "sentence_count": 0,
      "token_count": 0
    }
  ],
  "expected_primary_checks": [
    "sentence_count",
    "token_count"
  ],
  "assertion_policy": {
    "sentence_count": "exact",
    "token_count": "exact"
  },
  "manual_review_focus": [],
  "known_limitations": [],
  "notes": "v2 — white spot #: Проверяет поведение на пустых, near-empty, single-word документах."
}