{
  "corpus_id": "he_23_determinism",
  "version": "2.0.0",
  "title": "Determinism and reproducibility",
  "purpose": "Проверяет идентичность outputs при идентичных inputs.",
  "language": "he",
  "domain": "metallurgy",
  "recommended_profile": "any",
  "text_count": 3,
  "files": [
    {
      "filename": "identical_a.txt",
      "sentence_count": 3,
      "token_count": 10
    },
    {
      "filename": "identical_b.txt",
      "sentence_count": 3,
      "token_count": 10
    },
    {
      "filename": "ordering_test.txt",
      "sentence_count": 4,
      "token_count": 8
    }
  ],
  "expected_primary_checks": [
    "sentence_count",
    "token_count"
  ],
  "assertion_policy": {
    "sentence_count": "exact",
    "token_count": "exact"
  },
  "manual_review_focus": [],
  "known_limitations": [],
  "notes": "v2 — white spot #: Проверяет идентичность outputs при идентичных inputs."
}