{
  "corpus_id": "he_24_stopwords",
  "version": "2.0.0",
  "title": "Stopword filtering",
  "purpose": "Проверяет влияние stopword filtering на extraction.",
  "language": "he",
  "domain": "general",
  "recommended_profile": "any",
  "text_count": 2,
  "files": [
    {
      "filename": "content_heavy.txt",
      "sentence_count": 1,
      "token_count": 10
    },
    {
      "filename": "stopword_heavy.txt",
      "sentence_count": 1,
      "token_count": 17
    }
  ],
  "expected_primary_checks": [
    "sentence_count",
    "token_count"
  ],
  "assertion_policy": {
    "sentence_count": "exact",
    "token_count": "exact"
  },
  "manual_review_focus": [],
  "known_limitations": [],
  "notes": "v2 — white spot #: Проверяет влияние stopword filtering на extraction."
}